symbol,name,primary_exchange
TCSB,TD Select Short Term Corporate Bond Ladder ETF,TSX
FHG,First Trust AlphaDEX U.S. Industrials Sector Index ETF,TSX
FCIM,Fidelity International Momentum Index ETF Ser L,TSX
FHQ.F,First Trust AlphaDEX U.S. Technology Sector Index ETF Hedged,TSX
FCCM,Fidelity Canadian Momentum Index ETF Ser L,TSX
FCCB,Fidelity Systematic Canadian Bond Index ETF Ser L,TSX
CYBR.B,Evolve Cyber Security Index Fund  Unhedged,TSX
FHD,First Trust AlphaDEX U.S. Consumer Discretionary Sector Index ETF,TSX
FHU,First Trust AlphaDEX U.S. Utilities Sector Index ETF,TSX
TUSB.U,TD Select U.S. Short Term Corporate Bond Ladder ETF,TSX
FSL.A,First Trust Senior Loan ETF CAD-Hedged - Advisor Class,TSX
FSR,First Trust Dorsey Wright U.S. Sector Rotation Index ETF,TSX
VII,Seven Generations Energy Ltd. (Class A),TSX
STEP,STEP Energy Services Ltd,TSX
QEBL,Mackenzie Emerging Markets Local Currency Bond Index ETF Ser E,TSX
FCGI,Fidelity Global Monthly High Income ETF  Ser L,TSX
QCE,Mackenzie Canadian Large Cap Equity Index ETF Series E,TSX
FHE,First Trust AlphaDEX U.S. Energy Sector Index ETF,TSX
MIVG,Mackenzie Ivy Global Equity ETF Series E,TSX
CYBR,Evolve Cyber Security Index Fund  Hedged,TSX
FCGB,Fidelity Global Core Plus Bond ETF Ser L,TSX
FHC,First Trust AlphaDEX U.S. Consumer Staples Sector Index ETF,TSX
TCW,"Trican Well Service, Ltd.",TSX
BKL.C,Invesco Senior Loan Index ETF CAD,TSX
CFW,Calfrac Well Services Ltd.,TSX
QTIP,Mackenzie US TIPS Index ETF CAD-Hedged Ser E,AEQUITAS NEO EXCHANGE
FCMH,Fidelity U.S. Momentum Currency Neutral Index ETF Ser L,TSX
SFIX,Scotia Strategic Fixed Income ETF Portfolio,TSX
SFD,NXT Energy Solutions Inc,TSX
SGI,Superior Gold Inc,TSX-V
SGY,Surge Energy Inc,TSX
SGR.UN,Slate Grocery REIT,TSX
SHOP,Shopify Inc (Class A),TSX
SHLE,Source Energy Services Ltd,TSX
FGB,CI First Asset Short Term Government Bond Index Class ETF,TSX
CAGS,CI Investments Inc - CI Yield Enhanced Canada Short-Term Aggregate Bond Index ETF,TSX
ZFS,BMO Short Federal Bond Index ETF,TSX
FLSD,Franklin Liberty Short Duration Bond ETF,TSX
RPU,Purpose U.S. Preferred Share Fund,AEQUITAS NEO EXCHANGE
PMNT,PIMCO Global Short Maturity Fund,TSX
RPF,RBC Canadian Preferred Share ETF,TSX
PHE.B,Purpose Tactical Hedged Equity Fund NON-CURRENCY HEDGED SHARES,TSX
MSI,Morneau Shepell Inc,TSX
ZPS,BMO Short Provincial Bond Index ETF,TSX
ZUS.V,BMO Ultra Short-Term US Bond ETF USD Accumulating,TSX
RPS,Purpose Canadian Preferred Share Fund,AEQUITAS NEO EXCHANGE
TCSB,TD Select Short Term Corporate Bond Ladder ETF,TSX
ZTS,BMO Short-Term US Treasury Bond Index ETF,AEQUITAS NEO EXCHANGE
XSI,BlackRock Canada iShares Short Term Strategic Fixed Income ETF,TSX
RPU.B,Purpose U.S. Preferred Share Fund Non-Currency Hedged,AEQUITAS NEO EXCHANGE
TPRF,TD Active Preferred Share ETF,TSX
SJR.B,Shaw Communications Inc. (Class B),TSX
DCP,Desjardins Canadian Preferred Share Index ETF,TSX
ZPR,BMO Laddered Preferred Share Index ETF,TSX
TUSB.U,TD Select U.S. Short Term Corporate Bond Ladder ETF,TSX
XSH,BlackRock Canada iShares Core Cnd Short Term Corp+Maple Bnd idx ETF,TSX
DCS,Desjardins Canadian Short Term Bond Index ETF,TSX
XSQ,iShares Short Term High Quality Canadian Bond Index ETF,TSX
NPRF,NBI Active Canadian Preferred Shares ETF,TSX
HUF,Horizons Active Ultra-Short Term US Investment Grade Bond ETF - Cl E,TSX
ZUP,BMO US Preferred Share Index ETF,TSX
PPS,Invesco Canadian Preferred Share Index ETF,TSX
ZPS.L,BMO Short Provincial Bond Index ETF Accum,TSX
RPSB,RBC PH&N Short Term Canadian Bond ETF,TSX
ZST.L,BMO Ultra Short-Term Bond ETF Accum,TSX
ZST,BMO Ultra Short-Term Bond ETF,TSX
ZCS.L,BMO Short Corporate Bond Index ETF Accum,TSX
CJT,Cargojet Inc. Common and Variable Voting Shares,TSX
PBI.B,Purpose Best Ideas Fund ETF non-currency hedged shares,TSX
PSY.U,Invesco Global Shareholder Yield ETF,TSX
XSC,iShares Conservative Short Term Strategic Fixed Income ETF,TSX
PR,Lysander-Slater Preferred Share ActivETF,TSX
SIA,Sienna Senior Living Inc,TSX
SIL,SilverCrest Metals Inc,TSX
SIM,Siyata Mobile Inc,TSX-V
SIS,Savaria Corp.,TSX
SII,Sprott Inc,TSX
SID,CI First Asset U.S. TrendLeaders Index ETF,TSX
SINT,Scotia Strategic International Equity ETF Portfolio,TSX
HUZ,Horizons Silver ETF,TSX
MAG,MAG Silver Corp.,TSX
FR,First Majestic Silver Corporation,TSX
SBM,Sirona Biochem Corp,TSX-V
DV,Dolly Varden Silver Corp,TSX-V
ZFC,BMO SIA Focused Canadian Equity Fund,TSX
HPQ,HPQ-Silicon Resources Inc,TSX-V
MSV,Minco Silver Corporation,TSX
CEF,Sprott Physical Gold and Silver Trust - Unit,TSX
ASM,Avino Silver & Gold Mines Ltd.,TSX
HZD,BetaPro Silver -2x Daily Bear ETF,TSX
GRSL,Gr Silver Mining Ltd,TSX-V
DEF,Defiance Silver Corp,TSX-V
HZU,BetaPro Silver 2x Daily Bull ETF,TSX
RSLV,Reyna Silver Corp,TSX-V
ELEF,Silver Elephant Mining Corp,TSX
SMVEN,Silver Maple Ventures Inc,AEQUITAS NEO EXCHANGE
SW,Sierra Wireless Inc,TSX
SVM,Silvercorp Metals Inc,TSX
AAG,Aftermath Silver Ltd,TSX-V
AYA,Aya Gold & Silver Inc,TSX
SVR.C,BlackRock iShares Silver Bullion ETF Non-Hedged,TSX
SLVR,Silver Tiger Metals Inc,TSX-V
IPT,Impact Silver Corp.,TSX-V
PSLV,Sprott Physical Silver Trust,TSX
AUN,Aurcana Silver Corp,TSX-V
SSV,Southern Silver Exploration Corp.,TSX-V
SVB,Silver Bull Resources Inc,TSX
FVI,Fortuna Silver Mines Inc.,TSX
SBB,Sabina Gold & Silver Corp,TSX
KTN,Kootenay Silver Inc,TSX-V
ZFN,BMO SIA Focused North American Equity Fund,TSX
SVR,BlackRock iShares Silver Bullion ETF Hedged,TSX
EDR,Endeavour Silver Corp.,TSX
USA,Americas Gold and Silver Corp,TSX
VIPR,Silver Viper Minerals Corp,TSX-V
PAAS,Pan American Silver Corp,TSX
SJ,Stella-Jones Inc.,TSX
SJR.B,Shaw Communications Inc. (Class B),TSX
SKE,Skeena Resources Ltd,TSX
SLF,"Sun Life Financial, Inc.",TSX
SLV.H,Stealth Ventures Inc,TSX-V
SLL,Standard Lithium Ltd,TSX-V
SLVR,Silver Tiger Metals Inc,TSX-V
ZZZ,Sleep Country Canada Holdings Inc,TSX
SOT.UN,Slate Office Real Estate Investment Trust,TSX
PR,Lysander-Slater Preferred Share ActivETF,TSX
SGR.UN,Slate Grocery REIT,TSX
SMD,Strategic Metals Ltd,TSX-V
SMVEN,Silver Maple Ventures Inc,AEQUITAS NEO EXCHANGE
SMU.UN,Summit Industrial Income REIT,TSX
PZW.U,Invesco FTSE RAFI Global Small-Mid ETF CAD,TSX
SRU.UN,SmartCentres Real Estate Investment Trust,TSX
PZC,Invesco FTSE RAFI Canadian Small-Mid Index ETF,TSX
TQSM,TD Q U.S. Small-Mid-Cap Equity ETF,TSX
MUSC,Manulife Multifactor U.S. Small Cap Index ETF Hedged,TSX
ZSML,BMO S&P US Small Cap Index ETF,TSX
XCS,BlackRock Canada iShares S&P/TSX SmallCap Index ETF,TSX
XSMH,iShares S&P U.S. Small-Cap Index ETF CAD-Hedged,TSX
MUSC.B,Manulife Multifactor U.S. Small Cap Index ETF Unhedged,TSX
PZW,Invesco FTSE RAFI Global Small-Mid ETF CAD,TSX
XSU,BlackRock Canada iShares U.S. Small Cap Index ETF CAD-Hedged,TSX
ZSML.U,BMO S&P US Small Cap Index ETF,TSX
XSMC,iShares S&P U.S. Small-Cap Index ETF,TSX
HUM.U,Hamilton U.S. Mid/Small-Cap Financials ETF,TSX
MCSM,Manulife Multifactor Canadian SMID Cap Index ETF Unhedged,TSX
ZSML.F,BMO S&P US Small Cap Index ETF Hedged,TSX
PZW.F,Invesco FTSE RAFI Global Small-Mid ETF Hedged,TSX
SNC,SNC - Lavalin Group Inc.,TSX
SOT.UN,Slate Office Real Estate Investment Trust,TSX
SOY,"Sunopta, Inc.",TSX
DOC,CloudMD Software & Services Inc,TSX-V
ZEN,ZEN Graphene Solutions Ltd,TSX-V
SFD,NXT Energy Solutions Inc,TSX
CTS,Converge Technology Solutions Corp.,TSX-V
CEU,CES Energy Solutions Corp,TSX
OSS,OneSoft Solutions Inc,TSX-V
DRT,DIRTT Environmental Solutions Ltd,TSX
ABT,Absolute Software Corp,TSX
PTG,"Pivot Technology Solutions, Inc",TSX
NEPT,Neptune Wellness Solutions Inc,TSX
SHLE,Source Energy Services Ltd,TSX
XEN,BlackRock Canada iShares Jantzi Social Index ETF,TSX
SSV,Southern Silver Exploration Corp.,TSX-V
WSRI,Wealthsimple North America Socially Responsible Index ETF,TSX
QUIS,Quisitive Technology Solutions Inc,TSX-V
FSX,Fosterville South Exploration Ltd,TSX-V
WSRD,Wealthsimple Developed Markets ex North America Socially Responsible Index ETF,TSX
ZCN,BMO SP TSX CAPPED COMP IDX ETF,TSX
SPA,Spanish Mountain Gold Ltd,TSX-V
SPB,Superior Plus Corp,TSX
DFN,Dividend 15 Split Corp. (Class A),TSX
CEF,Sprott Physical Gold and Silver Trust - Unit,TSX
TOY,Spin Master Corp,TSX
PHYS,Sprott Physical Gold Trust,TSX
SII,Sprott Inc,TSX
PSLV,Sprott Physical Silver Trust,TSX
SRU.UN,SmartCentres Real Estate Investment Trust,TSX
SRX,Storm Resources Ltd,TSX
SSRM,SSR Mining Inc,TSX
SSL,Sandstorm Gold Ltd,TSX
SSV,Southern Silver Exploration Corp.,TSX-V
STE,Starr Peak Exploration Ltd,TSX-V
STLC,Stelco Holdings Inc,TSX
STEP,STEP Energy Services Ltd,TSX
STN,Stantec Inc,TSX
STGO,Steppe Gold Ltd,TSX
STPL,BMO Global Consumer Staples Hedged to CAD Index ETF,TSX
STC,Sangoma Technologies Corporation,TSX-V
RAY.A,Stingray Group Inc,TSX
SZLS,StageZero Life Sciences Ltd,TSX
SMD,Strategic Metals Ltd,TSX-V
PFMS,Picton Mahoney Fortified Multi-Strategy Alternative Fund,TSX
RLD,RBC Strategic Global Dividend Leaders ETF,TSX
SYLD,Purpose Strategic Yield Fund ETF,TSX
SFIX,Scotia Strategic Fixed Income ETF Portfolio,TSX
SLV.H,Stealth Ventures Inc,TSX-V
XSI,BlackRock Canada iShares Short Term Strategic Fixed Income ETF,TSX
SLL,Standard Lithium Ltd,TSX-V
SJ,Stella-Jones Inc.,TSX
GSV,Gold Standard Ventures Corp,TSX
FHC,First Trust AlphaDEX U.S. Consumer Staples Sector Index ETF,TSX
PMM,Purpose Multi-Strategy Market Neutral Fund ETF,TSX
FST,First Trust Canadian Capital Strength ETF Common,TSX
SUSA,Scotia Strategic U.S. Equity ETF Portfolio,TSX
SVI,Storagevault Canada Inc,TSX-V
XSC,iShares Conservative Short Term Strategic Fixed Income ETF,TSX
PREF,Evolve Dividend Stability Preferred Share Index ETF,TSX
SU,"Suncor Energy, Inc.",TSX
SUP,Northern Superior Resources Inc,TSX-V
SUSA,Scotia Strategic U.S. Equity ETF Portfolio,TSX
NSGE,NBI Sustainable Global Equity ETF,TSX
SLF,"Sun Life Financial, Inc.",TSX
SGI,Superior Gold Inc,TSX-V
AGSG,AGF Global Sustainable Growth Equity ETF,AEQUITAS NEO EXCHANGE
MDVD,Mackenzie Global Sustainable Dividend Index ETF CAD,TSX
SGY,Surge Energy Inc,TSX
SOY,"Sunopta, Inc.",TSX
NSCB,NBI Sustainable Canadian Bond ETF,TSX
FCSW,Fidelity Sustainable World ETF,AEQUITAS NEO EXCHANGE
SMU.UN,Summit Industrial Income REIT,TSX
FIRE,The Supreme Cannabis Company Inc,TSX
SPB,Superior Plus Corp,TSX
NSCE,NBI Sustainable Canadian Equity ETF,TSX
ESM,Euro Sun Mining Inc,TSX
RSI,Rogers Sugar Inc,TSX
PEAK.V,Sun Peak Metals Corp.,TSX-V
BSX,Belo Sun Mining Corp,TSX
MDVD.U,Mackenzie Global Sustainable Dividend Index ETF - USD,TSX
SVI,Storagevault Canada Inc,TSX-V
SVM,Silvercorp Metals Inc,TSX
SVR.C,BlackRock iShares Silver Bullion ETF Non-Hedged,TSX
SVB,Silver Bull Resources Inc,TSX
SVR,BlackRock iShares Silver Bullion ETF Hedged,TSX
SW,Sierra Wireless Inc,TSX
SWA,Sarama Resources Ltd,TSX-V
SYLD,Purpose Strategic Yield Fund ETF,TSX
PSI,Pason Systems Inc.,TSX
FCCB,Fidelity Systematic Canadian Bond Index ETF Ser L,TSX
GSI,Gatekeeper Systems Inc.,TSX-V
BES,Braille Energy Systems Inc,TSX-V
WPRT,Westport Fuel Systems Inc,TSX
DSG,Descartes Systems Group Inc,TSX
BLDP,Ballard Power Systems Inc.,TSX
KWE,KWESST Micro Systems Inc.,TSX-V
FCHY,Fidelity Systematic U.S. High Yield Bond ETF Ser L,TSX
ENGH,Enghouse Systems Ltd,TSX
ATA,"ATS Automation Tooling Systems, Inc.",TSX
FCHH,Fidelity Systematic U.S. High Yield Bnd Curr Neutral ETF Ser L,TSX
SZLS,StageZero Life Sciences Ltd,TSX
TA,Transalta Corp.,TSX
TAL,PetroTal Corp,TSX-V
DXB,Dynamic Active Tactical Bond ETF,TSX
PHE.B,Purpose Tactical Hedged Equity Fund NON-CURRENCY HEDGED SHARES,TSX
FTB,First Trust Tactical Bond Index ETF,TSX
RQH,RBC Target 2020 Corporate Bond Index ETF,TSX
ZZZD,BMO Tactical Dividend ETF Fund,TSX
PTB,Invesco Tactical Bond ETF,TSX
RQK,RBC Target 2023 Corporate Bond Index ETF,TSX
RQP,RBC Target 2027 Corporate Bond Index ETF CAD,TSX
TVE,Tamarack Valley Energy Ltd,TSX
DXM,CI First Asset Morningstar Canada Dividend Target 30 Index ETF,TSX
TKO,Taseko Mines Ltd.,TSX
RQJ,RBC Target 2022 Corporate Bond Index ETF,TSX
UXM.B,CI First Asset Morningstar US Dividend Target 50 Index ETF Unhedged,TSX
RQN,RBC Target 2025 Corporate Bond Index ETF,TSX
ATD.B,"Alimentation-Couche Tard, Inc. (Class B)",TSX
RQL,RBC Target 2024 Corporate Bond Index ETF,TSX
PHW,Purpose International Tactical Hedged Equity Fund ETF,TSX
RTA,Purpose Tactical Asset Allocation Fund,AEQUITAS NEO EXCHANGE
RQI,RBC Target 2021 Corporate Bond Index ETF,TSX
RQO,RBC Target 2026 Corporate Bond Index ETF CAD,TSX
UXM,CI First Asset Morningstar US Dividend Target 50 Index ETF,TSX
PHE,Purpose Tactical Hedged Equity Fund,TSX
TBP,Tetra Bio-Pharma Inc,TSX
TBX,Turmalina Metals Corp,TSX-V
TBRD,Thunderbird Entertainment Group Inc,TSX-V
TRP,TC Energy Corporation,TSX
TCL.A,"Transcontinental, Inc. (Class A)",TSX
TCSB,TD Select Short Term Corporate Bond Ladder ETF,TSX
TCW,"Trican Well Service, Ltd.",TSX
TCLB,TD Canadian Long Term Federal Bond ETF,TSX
TCLV,TD Q Canadian Low Volatility ETF CAD,TSX
TCN,Tricon Residential Inc,TSX
TD,Toronto Dominion Bank,TSX
TPAY,TD Income Builder ETF,TSX
TDB,TD Canadian Aggregate Bond Index ETF,TSX
TQGM,TD Q Global Multifactor ETF,TSX
TPRF,TD Active Preferred Share ETF,TSX
TPU,TD U.S. Equity Index ETF,TSX
TGFI,TD Active Global Income ETF,TSX
TTP,TD Canadian Equity Index ETF,TSX
TQCD,TD Q Canadian Dividend ETF,TSX
TQGD,TD Q Global Dividend ETF,TSX
TPE,TD International Equity Index ETF,TSX
TULV,TD Q U.S. Low Volatility ETF CAD,TSX
TOCM,TD One Click Moderate ETF Portfolio,TSX
TINF,TD Active Global Infrastructure Equity ETF CAD,TSX
TCLB,TD Canadian Long Term Federal Bond ETF,TSX
TOCA,TD One Click Aggressive ETF Portfolio,TSX
TULB,TD U.S. Long Term Treasury Bond ETF,TSX
TGGR,TD Active Global Equity Growth ETF CAD,TSX
TOCC,TD One Click Conservative ETF Portfolio,TSX
TUED,TD Active U.S. Enhanced Dividend ETF  CAD,TSX
TUHY,TD Active U.S. High Yield Bond ETF,TSX
TEC,TD Global Technology Leaders Index ETF,TSX
THU,TD U.S. Equity CAD Hedged Index ETF,TSX
TGRE,TD Active Global Real Estate Equity ETF,TSX
TCLV,TD Q Canadian Low Volatility ETF CAD,TSX
TILV,TD Q International Low Volatility ETF,TSX
TGED,TD Active Global Enhanced Dividend ETF,TSX
THE,TD International Equity CAD Hedged Index ETF,TSX
TCSB,TD Select Short Term Corporate Bond Ladder ETF,TSX
TQSM,TD Q U.S. Small-Mid-Cap Equity ETF,TSX
TUSB.U,TD Select U.S. Short Term Corporate Bond Ladder ETF,TSX
TUSB,TD Select U.S. Short Term Corporate Bond Ladder ETF,TSX
TECK.B,Teck Resources Ltd (Class B),TSX
TEC,TD Global Technology Leaders Index ETF,TSX
FGB,CI First Asset Short Term Government Bond Index Class ETF,TSX
CAGS,CI Investments Inc - CI Yield Enhanced Canada Short-Term Aggregate Bond Index ETF,TSX
ZTM.U,BMO Mid-Term US Treasury Bond Index ETF,AEQUITAS NEO EXCHANGE
WELL,WELL Health Technologies Corp,TSX
RTI,Radient Technologies Inc,TSX-V
RHT,Reliq Health Technologies Inc,TSX-V
XIT,BlackRock Canada iShares S&P/TSX Capped Information Tech Index ETF,TSX
HTA.B,Harvest Tech Achievers Growth & Income ETF  Unhedged,TSX
ZUS.V,BMO Ultra Short-Term US Bond ETF USD Accumulating,TSX
VISN,Binovi Technologies Corp.,TSX-V
TCSB,TD Select Short Term Corporate Bond Ladder ETF,TSX
VLB,Vanguard Canadian Long-Term Bond Index ETF,TSX
ZTS,BMO Short-Term US Treasury Bond Index ETF,AEQUITAS NEO EXCHANGE
FHQ.F,First Trust AlphaDEX U.S. Technology Sector Index ETF Hedged,TSX
XSI,BlackRock Canada iShares Short Term Strategic Fixed Income ETF,TSX
ZIC,BMO Mid-Term US IG Corporate Bond Index ETF CAD,TSX
OTEX,Open Text Corp,TSX
TUSB.U,TD Select U.S. Short Term Corporate Bond Ladder ETF,TSX
WTE,Westshore Terminals Investment Corporation,TSX
XSH,BlackRock Canada iShares Core Cnd Short Term Corp+Maple Bnd idx ETF,TSX
CTS,Converge Technology Solutions Corp.,TSX-V
DCS,Desjardins Canadian Short Term Bond Index ETF,TSX
XSQ,iShares Short Term High Quality Canadian Bond Index ETF,TSX
TBP,Tetra Bio-Pharma Inc,TSX
MAXR,Maxar Technologies Inc,TSX
HUF,Horizons Active Ultra-Short Term US Investment Grade Bond ETF - Cl E,TSX
HIRE,Hire Technologies Inc,TSX-V
TXF.B,CI First Asset Tech Giants Covered Call ETF - Unhedged,TSX
TLF.U,Brompton Tech Leaders Income ETF,TSX
RPSB,RBC PH&N Short Term Canadian Bond ETF,TSX
TF,Timbercreek Financial Corp,TSX
TFII,TFI International Inc,TSX
TGFI,TD Active Global Income ETF,TSX
TGGR,TD Active Global Equity Growth ETF CAD,TSX
TGM,Trillium Gold Mines Inc.,TSX-V
TGZ,Teranga Gold Corporation,TSX
TGRE,TD Active Global Real Estate Equity ETF,TSX
TGOD,Green Organic Dutchman Holdings Ltd,TSX
TGED,TD Active Global Enhanced Dividend ETF,TSX
TH,Theratechnologies Inc.,TSX
THRM,Therma Bright Inc,TSX-V
THU,TD U.S. Equity CAD Hedged Index ETF,TSX
THE,TD International Equity CAD Hedged Index ETF,TSX
ATE,Antibe Therapeutics Inc,TSX-V
VCNS,Vanguard Conservative ETF Portfolio the,TSX
VGRO,Vanguard Growth ETF Portfolio the,TSX
EMH,Emerald Health Therapeutics Inc,TSX-V
VBAL,Vanguard Balanced ETF Portfolio the,TSX
FIRE,The Supreme Cannabis Company Inc,TSX
GUD,Knight Therapeutics Inc,TSX
TRI,Thomson-Reuters Corp,TSX
CRDL,Cardiol Therapeutics Inc (Class A),TSX
VLNS,Valens Company Inc (The),TSX
APLI,Appili Therapeutics Inc,TSX
QBTC.U,The Bitcoin Fund - Unit - Class A,TSX
FLWR,Flowr Corp. (The),TSX-V
TRIL,Trillium Therapeutics Inc,TSX
TBRD,Thunderbird Entertainment Group Inc,TSX-V
REAX,The Real Brokerage Inc.,TSX-V
TIC,"Titanium Corporation, Inc.",TSX-V
TINF,TD Active Global Infrastructure Equity ETF CAD,TSX
TIH,Toromont Industries Ltd.,TSX
TILV,TD Q International Low Volatility ETF,TSX
TRC,Tisdale Resources Corp.,TSX-V
GTE,Gran Tierra Energy Inc,TSX
QTIP,Mackenzie US TIPS Index ETF CAD-Hedged Ser E,AEQUITAS NEO EXCHANGE
TF,Timbercreek Financial Corp,TSX
SLVR,Silver Tiger Metals Inc,TSX-V
TWM,Tidewater Midstream and Infrastructure Ltd,TSX
WFT,"West Fraser Timber Co., Ltd.",TSX
CTC.A,"Canadian Tire Corp., Ltd. (Class A)",TSX
TMD,Titan Medical Inc,TSX
TKO,Taseko Mines Ltd.,TSX
TLG,Troilus Gold Corp,TSX
TLF.U,Brompton Tech Leaders Income ETF,TSX
TLV,Invesco S&P/TSX Composite Low Volatility Index ETF,TSX
TLF,Brompton Tech Leaders Income ETF,TSX
TM,Trigon Metals Inc,TSX-V
TMR,TMAC Resources Inc,TSX
TML,Treasury Metals Inc,TSX
TMD,Titan Medical Inc,TSX
X,TMX Group Ltd,TSX
TNT.UN,True North Commercial Real Estate Investment Trust,TSX
ZDH,BMO International Dividend Hedged to CAD ETF,TSX
ZUD,BMO US Dividend Hedged to CAD ETF,TSX
ZWS,BMO US High Dividend Covered Call Hedged to CAD ETF,TSX
ZPH,BMO US Put Write Hedged to CAD ETF,TSX
ZEQ,BMO MSCI Europe High Quality Hedged to CAD Index ETF,TSX
ZUB,BMO Equal Weight US Banks Hedged to CAD Index ETF,TSX
ZEF,BMO Emerging Markets Bond Hedged to CAD Index ETF,TSX
ESGF,BMO ESG US Corporate Bond Hedged to CAD Index ETF,TSX
ZLD,BMO Low Volatility International Equity Hedged to CAD ETF,TSX
ZHP,BMO US Preferred Share Hedged to CAD Index ETF,TSX
ZDJ,BMO Dow Jones Industrial Average Hedged to CAD Index ETF,TSX
ZLH,BMO Low Volatility US Equity Hedged to CAD ETF,TSX
ZUE,BMO S&P 500 Hedged to CAD Index ETF,TSX
ZWE,BMO Europe High Dividend Covered Call Hedged to CAD ETF,TSX
STPL,BMO Global Consumer Staples Hedged to CAD Index ETF,TSX
ZQQ,BMO Nasdaq 100 Equity Hedged To CAD Index ETF,TSX
DISC,BMO Global Consumer Discretionary Hedged to CAD Index ETF,TSX
ZDM,BMO MSCI EAFE Hedged to CAD Index ETF,TSX
ZMT,BMO Equal Weight Global Base Metals Hedged to CAD Index ETF,TSX
ZWA,BMO Covered Call Dow Jones Industrial Average Hedged to CAD ETF,TSX
ZUH,BMO Equal Weight US Health Care Hdgd to CAD Index ETF,TSX
ZHY,BMO High Yield US Corporate Bond Hedged to CAD Index ETF,TSX
ZSU,BMO Short-Term US IG Corporate Bond Hedged to CAD Index ETF,TSX
ZMU,BMO Mid-Term US IG Corporate Bond Hedged to CAD Index ETF,TSX
TOU,Tourmaline Oil Corp,TSX
TOG,TORC Oil & Gas Ltd,TSX
TOCM,TD One Click Moderate ETF Portfolio,TSX
TOY,Spin Master Corp,TSX
TOCA,TD One Click Aggressive ETF Portfolio,TSX
TOCC,TD One Click Conservative ETF Portfolio,TSX
TORO,Pucara Gold Ltd.,TSX-V
TXP,Touchstone Exploration Inc.,TSX
TXG,Torex Gold Resources Inc,TSX
XUU,BlackRock Canada iShares Core S&P U.S. Total Market Index ETF,TSX
TIH,Toromont Industries Ltd.,TSX
PBD,Purpose Total Return Bond Fund,TSX
VUS,Vanguard U.S. Total Market Index ETF CAD-hedged,TSX
TD,Toronto Dominion Bank,TSX
CDLB,CI DoubleLine Total Return Bond USD Fund ETF CAD Hedged,TSX
CDLB.B,CI DoubleLine Total Return Bond USD Fund ETF CAD Unhedged,TSX
ATA,"ATS Automation Tooling Systems, Inc.",TSX
XUU.U,BlackRock Canada iShares Core S&P U.S. Total Market Index ETF,TSX
XUH,BlackRock Canada iShares Core S&P US Total Market Indx ETF CAD-Hedgd,TSX
TPRF,TD Active Preferred Share ETF,TSX
TPU,TD U.S. Equity Index ETF,TSX
TPAY,TD Income Builder ETF,TSX
TPE,TD International Equity Index ETF,TSX
TQGM,TD Q Global Multifactor ETF,TSX
TQSM,TD Q U.S. Small-Mid-Cap Equity ETF,TSX
TQCD,TD Q Canadian Dividend ETF,TSX
TQGD,TD Q Global Dividend ETF,TSX
TRL,Trilogy International Partners Inc,TSX
TRZ,"Transat A.T., Inc.",TSX
TRIL,Trillium Therapeutics Inc,TSX
TRC,Tisdale Resources Corp.,TSX-V
TRQ,Turquoise Hill Resources Ltd,TSX
TRI,Thomson-Reuters Corp,TSX
TRP,TC Energy Corporation,TSX
CRR.UN,Crombie Real Estate Investment Trust,TSX
ZTM.U,BMO Mid-Term US Treasury Bond Index ETF,AEQUITAS NEO EXCHANGE
AD.UN,Alaris Equity Partners Income Trust,TSX
AP.UN,Allied Properties Real Estate Investment Trust,TSX
ZUT,BMO EQ Wght UT Trust Units,TSX
SRU.UN,SmartCentres Real Estate Investment Trust,TSX
GRT.UN,Granite Real Estate Investment Trust,TSX
FTB,First Trust Tactical Bond Index ETF,TSX
FUD.A,First Trust Value Line Dividend Index ETF CAD-Hedged-Advisor Class,TSX
IIP.UN,InterRent Real Estate Investment Trust,TSX
TCL.A,"Transcontinental, Inc. (Class A)",TSX
ZTS,BMO Short-Term US Treasury Bond Index ETF,AEQUITAS NEO EXCHANGE
FRO.UN,Fronsac Real Estate Investment Trust,TSX-V
FHG,First Trust AlphaDEX U.S. Industrials Sector Index ETF,TSX
DRA.UN,Dream Hard Asset Alternatives Trust,TSX
FHQ.F,First Trust AlphaDEX U.S. Technology Sector Index ETF Hedged,TSX
CEF,Sprott Physical Gold and Silver Trust - Unit,TSX
FDE,First Trust AlphaDEX Emerging Market Dividend ETF CAD-Hedged,TSX
FHD,First Trust AlphaDEX U.S. Consumer Discretionary Sector Index ETF,TSX
FHU,First Trust AlphaDEX U.S. Utilities Sector Index ETF,TSX
CUF.UN,Cominar Real Estate Investment Trust,TSX
FSL.A,First Trust Senior Loan ETF CAD-Hedged - Advisor Class,TSX
FSR,First Trust Dorsey Wright U.S. Sector Rotation Index ETF,TSX
NWH.UN,NorthWest Healthcare Properties REIT Investment Trust,TSX
TLG,Troilus Gold Corp,TSX
XUT,BlackRock Canada iShares S&P/TSX Capped Utilities Index ETF,TSX
XFN,BlackRock Canada iShares S&P/TSX Capped Financials Index ETF,TSX
XIT,BlackRock Canada iShares S&P/TSX Capped Information Tech Index ETF,TSX
HXD,BetaPro S&P/TSX 60 -2x Daily Bear ETF,TSX
HIX,BetaPro S&P/TSX 60 Daily Inverse ETF,TSX
XEG,BlackRock Canada iShares S&P/TSX Capped Energy Index ETF,TSX
CDZ,BlackRock iShares S&P/TSX Canadian Dividend Aristocrats Index ETF,TSX
XGD,BlackRock Canada iShares S&P/TSX Global Gold Index ETF,TSX
REIT,Invesco S&P/TSX REIT Income Index ETF,TSX
HXU,BetaPro S&P/TSX 60 2x Daily Bull ETF,TSX
XCS,BlackRock Canada iShares S&P/TSX SmallCap Index ETF,TSX
HXCN,Horizons S&P/TSX Capped Composite Index ETF,TSX
XMD,BlackRock Canada iShares S&P/TSX Completion Index ETF,TSX
XEI,iShares S&P/TSX Composite High Dividend Index ETF,TSX
XIU,BlackRock Canada iShares S&P/TSX 60 Index ETF,TSX
HED,BetaPro S&P/TSX Capped Energy -2x Daily Bear ETF,TSX
HXE,Horizons S&P/TSX Capped Energy Index ETF,TSX
XST,BlackRock Canada iShares S&P/TSX Capped Consumer Staples Index ETF,TSX
CPD,BlackRock iShares S&P/TSX Canadian Preferred Share Index ETF,TSX
XMA,BlackRock Canada iShares S&P/TSX Capped Materials Index ETF,TSX
XIC,BlackRock iShares Core S&P/TSX Capped Composite Index ETF,TSX
HXF,Horizons S&P/TSX Capped Financials Index ETF,TSX
XPF,BlackRock Canada iShares S&P/TSX North American PRF Stk Idx ETF,TSX
XRE,BlackRock Canada iShares S&P/TSX Capped REIT Index ETF,TSX
HFD,BetaPro S&P/TSX Capped Financials -2x Daily Bear ETF,TSX
TLV,Invesco S&P/TSX Composite Low Volatility Index ETF,TSX
HFU,BetaPro S&P/TSX Capped Financials 2x Daily Bull ETF,TSX
HXT,Horizons S&P/TSX 60 Index ETF,TSX
ZCN,BMO SP TSX CAPPED COMP IDX ETF,TSX
HEU,BetaPro S&P/TSX Capped Energy 2x Daily Bull ETF,TSX
XBM,BlackRock Canada iShares S&P/TSX Global Base Metals Index ETF,TSX
TTP,TD Canadian Equity Index ETF,TSX
TUD,Tudor Gold Corp,TSX-V
TULV,TD Q U.S. Low Volatility ETF CAD,TSX
TUSB.U,TD Select U.S. Short Term Corporate Bond Ladder ETF,TSX
TULB,TD U.S. Long Term Treasury Bond ETF,TSX
TUED,TD Active U.S. Enhanced Dividend ETF  CAD,TSX
TUHY,TD Active U.S. High Yield Bond ETF,TSX
TUO,Teuton Resources Corp.,TSX-V
TUSB,TD Select U.S. Short Term Corporate Bond Ladder ETF,TSX
TRQ,Turquoise Hill Resources Ltd,TSX
TBX,Turmalina Metals Corp,TSX-V
TVE,Tamarack Valley Energy Ltd,TSX
TWM,Tidewater Midstream and Infrastructure Ltd,TSX
TXP,Touchstone Exploration Inc.,TSX
TXF.B,CI First Asset Tech Giants Covered Call ETF - Unhedged,TSX
TXG,Torex Gold Resources Inc,TSX
TXF,CI First Asset Tech Giants Covered Call ETF,TSX
UDA,Caldwell U.S. Dividend Advantage Fund,TSX
UGE,UGE International Ltd,TSX-V
UGD,"Unigold, Inc.",TSX-V
UHD.U,Invesco S&P 500 High Dividend Low Volatility Index ETF,AEQUITAS NEO EXCHANGE
UHD,Invesco S&P 500 High Dividend Low Volatility Index ETF,AEQUITAS NEO EXCHANGE
UHD.F,Invesco S&P 500 High Dividend Low Volatility Indx ETF CAD Hedgd,AEQUITAS NEO EXCHANGE
ULV.U,Invesco S&P 500 Low Volatility Index ETF CAD Unhedged,TSX
ULV.C,Invesco S&P 500 Low Volatility Index ETF CAD Unhedged,TSX
ULV.F,Invesco S&P 500 Low Volatility Index ETF CAD,TSX
ZUS.V,BMO Ultra Short-Term US Bond ETF USD Accumulating,TSX
HUF,Horizons Active Ultra-Short Term US Investment Grade Bond ETF - Cl E,TSX
ZST.L,BMO Ultra Short-Term Bond ETF Accum,TSX
ZST,BMO Ultra Short-Term Bond ETF,TSX
HFR,Horizons Active Ultra-Short Term Investment Grade Bond ETF -,TSX
ZUS.U,BMO Ultra Short-Term US Bond ETF,TSX
UMI.B,CI Investments Inc - CI WisdomTree U.S. MidCap Dividend (Unhedged Units),TSX
UMI,CI Investments Inc - CI WisdomTree U.S. MidCap Div,TSX
UNS,Uni-Select Inc.,TSX
NXF.B,CI First Asset Energy Giants Covered Call ETF Unhedged,TSX
ESG,Invesco S&P 500 ESG Index ETF CAD units,TSX
