symbol,name,primary_exchange
CMAR,CI Marret Alternative Absolute Return Bond ETF,TSX
CMUE.F,CIBC Multifactor U.S. Equity ETF Hedged,TSX
CMMC,Copper Mountain Mining Corporation,TSX
CMCE,CIBC Multifactor Canadian Equity ETF,TSX
CNQ,Canadian Natural Resources Ltd.,TSX
CNR,Canadian National Railway Co.,TSX
CNE,Canacol Energy Ltd,TSX
CNC,Canada Nickel Company Inc,TSX-V
XSH,BlackRock Canada iShares Core Cnd Short Term Corp+Maple Bnd idx ETF,TSX
CNR,Canadian National Railway Co.,TSX
CP,Canadian Pacific Railway Ltd,TSX
CPD,BlackRock iShares S&P/TSX Canadian Preferred Share Index ETF,TSX
CPX,Capital Power Corp,TSX
CPG,Crescent Point Energy Corp,TSX
CR,Crew Energy Inc.,TSX
CRR.UN,Crombie Real Estate Investment Trust,TSX
CRED,CI Lawrence Park Alternative Investment Grade Credit ETF,TSX
CRE,Critical Elements Lithium Corporation,TSX-V
CRH,CRH Medical Corporation,TSX
CRED.U,CI Lawrence Park Alternative Investment Grade Credit ETF,TSX
CRON,Cronos Group Inc,TSX
CRRX,CareRx Corporation,TSX
CRQ,BlackRock iShares Canadian Fundamental Index ETF,AEQUITAS NEO EXCHANGE
CRDL,Cardiol Therapeutics Inc (Class A),TSX
CRT.UN,CT Real Estate Investment Trust,TSX
BPRF,Brompton Flaherty & Crumrine Investment Grade Preferred ETF,TSX
HOD,BetaPro Crude Oil Inverse Leveraged Daily Bear ETF,TSX
AMK,American Creek Resources Ltd,TSX-V
HOU,BetaPro Crude Oil Leveraged Daily Bull ETF,TSX
PYF.U,Purpose Premium Yield Fund USD ETF Non-Crrncy Hdgd Shr,TSX
HUC,Horizons Crude Oil ETF,TSX
BCM,Bear Creek Mining Corp.,TSX-V
IGCF,PIMCO Investment Grade Credit Fund ETF,TSX
DXO,Dynamic Active Crossover Bond ETF,TSX
CPG,Crescent Point Energy Corp,TSX
FAO.U,CI First Asset Active Credit ETF,TSX
FAO,CI First Asset Active Credit ETF,TSX
CS,Capstone Mining Corporation,TSX
CSY,CI First Asset Core Canadian Equity Income Class ETF,TSX
CSH.UN,Chartwell Retirement Residences,TSX
CSD,BlackRock iShares Short Duration High Income ETF CAD-Hedged,TSX
QCH,Mackenzie China A-Shares CSI 300 Index ETF,AEQUITAS NEO EXCHANGE
CRT.UN,CT Real Estate Investment Trust,TSX
CTS,Converge Technology Solutions Corp.,TSX-V
CTC.A,"Canadian Tire Corp., Ltd. (Class A)",TSX
CU,Canadian Utilities Ltd. (Class A),TSX
CUD,BlackRock iShares US Dividend Growers Index ETF CAD-Hedged,TSX
CUF.UN,Cominar Real Estate Investment Trust,TSX
CUR,International Consolidated Uranium Inc,TSX-V
PHE.B,Purpose Tactical Hedged Equity Fund NON-CURRENCY HEDGED SHARES,TSX
RPU.B,Purpose U.S. Preferred Share Fund Non-Currency Hedged,AEQUITAS NEO EXCHANGE
QEBL,Mackenzie Emerging Markets Local Currency Bond Index ETF Ser E,TSX
FCQH,Fidelity U.S. High Quality Currency Neutral Index ETF,TSX
HARC,Horizons Absolute Return Global Currency ETF,TSX
PBI.B,Purpose Best Ideas Fund ETF non-currency hedged shares,TSX
FCMH,Fidelity U.S. Momentum Currency Neutral Index ETF Ser L,TSX
FCRH,Fidelity U.S. Div. for Rising Rates Currency Ntrl Index ETF,TSX
SBT.B,ETF Non-Currency Hedged,TSX
PUD.B,Purpose US Dividend Fund ETF Non Currency Hedged,TSX
SBT,ETF Currency Hedged,TSX
FCLH,Fidelity U.S. Low Volatility Currency Neutral Index ETF,TSX
DLR,Horizons US Dollar Currency ETF,TSX
PYF.B,Purpose Premium Yield Fund ETF Non-Currency Hedged Shares,TSX
FCVH,Fidelity U.S. Value Currency Neutral Index ETF Ser L,TSX
FCUH,Fidelity U.S. High Dividend Currency Neutral Index ETF,TSX
KILO.B,Purpose Gold Bullion Fund Non-Currency Hedged,TSX
KILO.U,Purpose Gold Bullion Fund Non-Currency Hedged,TSX
FCHH,Fidelity Systematic U.S. High Yield Bnd Curr Neutral ETF Ser L,TSX
FLOT.B,Purpose Floating Rate Income Fund Non-Currency Hedged CAD ETF,TSX
CVD,BlackRock iShares Convertible Bond Index ETF,TSX
CVB,Compass Gold Corp,TSX-V
CVX,Cematrix Corporation,TSX-V
CVE,Cenovus Energy Inc,TSX
CWW,BlackRock iShares Global Water Index ETF,TSX
CWO,BlackRock iShares Emerging Markets Fundamental Index ETF,AEQUITAS NEO EXCHANGE
CWEB,Charlottes Web Holdings Inc,TSX
CWB,Canadian Western Bank,TSX
CWX,CanWel Building Materials Group Ltd,TSX
CXF,CI First Asset Canadian Convertible Bond ETF,TSX
CXB,Calibre Mining Corp,TSX
CYP,Cypress Development Corp.,TSX-V
CYBR.B,Evolve Cyber Security Index Fund  Unhedged,TSX
CYBR,Evolve Cyber Security Index Fund  Hedged,TSX
CYBR.U,Evolve Cyber Security Index Fund USD Unhedged,TSX
CYH,BlackRock iShares Global Monthly Dividend Index ETF CAD-Hedged,TSX
DANC,Desjardins Alt Long/Short Equity Market Neutral ETF,TSX
HOD,BetaPro Crude Oil Inverse Leveraged Daily Bear ETF,TSX
HXD,BetaPro S&P/TSX 60 -2x Daily Bear ETF,TSX
HIX,BetaPro S&P/TSX 60 Daily Inverse ETF,TSX
HNU,BetaPro Natural Gas Leveraged Daily Bull ETF,TSX
HQU,BetaPro NASDAQ-100 2x Daily Bull ETF,TSX
HXU,BetaPro S&P/TSX 60 2x Daily Bull ETF,TSX
HSU,BetaPro S&P 500 2x Daily Bull ETF,TSX
HMJU,BetaPro Marijuana Companies 2x Daily Bull ETF,TSX
HBD,BetaPro Gold Bullion -2x Daily Bear ETF,TSX
HIU,BetaPro S&P 500 Daily Inverse ETF,TSX
HZD,BetaPro Silver -2x Daily Bear ETF,TSX
EAAI.U,Emerge ARK AI & Big Data ETF,AEQUITAS NEO EXCHANGE
HZU,BetaPro Silver 2x Daily Bull ETF,TSX
HGU,BetaPro Canadian Gold Miners 2x Daily Bull ETF,TSX
HOU,BetaPro Crude Oil Leveraged Daily Bull ETF,TSX
HED,BetaPro S&P/TSX Capped Energy -2x Daily Bear ETF,TSX
HSD,BetaPro S&P 500 -2x Daily Bear ETF,TSX
BAD,Badger Daylighting Ltd,TSX
HFD,BetaPro S&P/TSX Capped Financials -2x Daily Bear ETF,TSX
EAAI,Emerge ARK AI & Big Data ETF,AEQUITAS NEO EXCHANGE
HBU,BetaPro Gold Bullion 2x Daily Bull ETF,TSX
HGD,BetaPro Canadian Gold Miners -2x Daily Bear ETF,TSX
HFU,BetaPro S&P/TSX Capped Financials 2x Daily Bull ETF,TSX
HND,BetaPro Natural Gas Inverse Leveraged Daily Bear ETF,TSX
HEU,BetaPro S&P/TSX Capped Energy 2x Daily Bull ETF,TSX
HQD,BetaPro NASDAQ-100 -2x Daily Bear ETF,TSX
DB,Decibel Cannabis Company Inc,TSX-V
DCP,Desjardins Canadian Preferred Share Index ETF,TSX
DCBO,Docebo Inc,TSX
DCG,Desjardins 1-5 year Laddered Canadian Government Bond Index ETF,TSX
DCS,Desjardins Canadian Short Term Bond Index ETF,TSX
DC.A,Dundee Corporation (Class A),TSX
DCU,Desjardins Canadian Universe Bond Index ETF,TSX
DCC,Desjardins 1-5 year Laddered Canadian Corporate Bond Index ETF,TSX
DEF,Defiance Silver Corp,TSX-V
DEX.H,Detector Exploration Ltd.,TSX-V
CYP,Cypress Development Corp.,TSX-V
DRCU,Desjardins RI Active Canadian Bond - Low CO2 ETF,TSX
DFU,Desjardins USA Multifactor-Controlled Volatility ETF,TSX
NB,NioCorp Developments Ltd,TSX
MEU,Mackenzie Maximum Diversification Developed Europe Index ETF,TSX
VEF,Vanguard FTSE Developed All Cap Ex U.S. Index ETF CAD-hedged,TSX
DRMD,Desjardins RI Developed ex USA ex-Canada - Low CO2 Index ETF,TSX
DCP,Desjardins Canadian Preferred Share Index ETF,TSX
DFE,Desjardins Emerging Markets Multifactor-Controlled Volatility ETF,TSX
DCG,Desjardins 1-5 year Laddered Canadian Government Bond Index ETF,TSX
DCS,Desjardins Canadian Short Term Bond Index ETF,TSX
VIU,Vanguard FTSE Developed All Cap ex North America Index ETF,TSX
DRFC,Desjardins RI Canada Multifactor - Low CO2 ETF,TSX
MWD,Mackenzie Maximum Diversification All World Developed Index ETF,TSX
QRET,Mackenzie Developed Markets Real Estate Index ETF,TSX
VDU,Vanguard FTSE Developed All Cap Ex U.S. Index ETF,TSX
MXU,Mackenzie Max Divers All World Developed ex North America Index ETF,TSX
DFC,Desjardins Canada Multifactor-Controlled Volatility ETF,TSX
DSG,Descartes Systems Group Inc,TSX
DRFG,Desjardins RI Global Multifactor Fossil Fuel Reserves Free ETF,TSX
ERD,Erdene Resource Development Corp,TSX
PEY,Peyto Exploration & Development Corp.,TSX
HXDM,Horizons Intl Developed Markets Equity Index ETF,TSX
DRMU,Desjardins RI USA Low CO2 Index ETF,TSX
DCU,Desjardins Canadian Universe Bond Index ETF,TSX
DCC,Desjardins 1-5 year Laddered Canadian Corporate Bond Index ETF,TSX
DRFD,Desjardins RI Developed ex USA ex-Canada Multifactor - Low CO2 ETF,TSX
DRMC,Desjardins RI Canada Low CO2 Index ETF,TSX
DFD,Desjardins Developed ex-USA ex-Canada Multifactor Cont Volatility ETF,TSX
DANC,Desjardins Alt Long/Short Equity Market Neutral ETF,TSX
VI,Vanguard FTSE Developed All Cap ex North America Index ETFCAD-Hedged,TSX
DN,Delta 9 Cannabis Inc,TSX
CD,Cantex Mine Development Corp.,TSX-V
ILV,Invesco S&P International Developed Low Vol Index ETF,TSX
VIDY,Vanguard FTSE Developed ex North America High Dividend Yield Index ETF,TSX
DB,Decibel Cannabis Company Inc,TSX-V
VE,Vanguard FTSE Developed Europe All Cap Index ETF,TSX
MINT.B,Manulife Multifactor Developed International Index ETF Unhedged,TSX
MINT,Manulife Multifactor Developed International Index ETF Hedged,TSX
DFN,Dividend 15 Split Corp. (Class A),TSX
DFU,Desjardins USA Multifactor-Controlled Volatility ETF,TSX
DFE,Desjardins Emerging Markets Multifactor-Controlled Volatility ETF,TSX
DFC,Desjardins Canada Multifactor-Controlled Volatility ETF,TSX
DFD,Desjardins Developed ex-USA ex-Canada Multifactor Cont Volatility ETF,TSX
DGR,CI Investments Inc - CI WisdomTree U.S. Qty Divi Growth Index ETF(Hedged Units),TSX
DGR.B,CI Investments Inc - CI WisdomTree U.S. Qty Divi Growth Index ETF(Unhedged Units),TSX
DGRC,CI Investments Inc - CI WisdomTree Canada Quality Dividend Growth Index ETF,TSX
DISC,BMO Global Consumer Discretionary Hedged to CAD Index ETF,TSX
DIV,Diversified Royalty Corp,TSX
DIAM,Star Diamond Corp,TSX
DII.B,Dorel Industries Inc. (Class B),TSX
DIVS,Evolve Active Canadian Preferred Share Fund  Unhedged,TSX
DIR.UN,Dream Industrial Real Estate Investment Trust,TSX
DFN,Dividend 15 Split Corp. (Class A),TSX
XDU,iShares Core MSCI US Quality Dividend Index ETF,TSX
MUS,Mackenzie Maximum Diversification US Index ETF,TSX
FCUD,Fidelity U.S. High Dividend Index ETF,TSX
RLD,RBC Strategic Global Dividend Leaders ETF,TSX
ZDH,BMO International Dividend Hedged to CAD ETF,TSX
IQD,CI Investments Inc - CI WisdomTree International Qlty Divi Growth Index ETF(Hedged Units),TSX
ZWP,BMO Europe High Dividend Covered Call ETF CAD,TSX
ZWS,BMO US High Dividend Covered Call Hedged to CAD ETF,TSX
DQD,CI Investments Inc - CI WisdomTree U.S. Quality Dividend Growth Variably Hedged Index ETF,TSX
RUD,RBC Quant U.S. Dividend Leaders ETF CAD,TSX
FUD.A,First Trust Value Line Dividend Index ETF CAD-Hedged-Advisor Class,TSX
EARK.U,Emerge ARK Global Disruptive Innovation ETF,AEQUITAS NEO EXCHANGE
MEU,Mackenzie Maximum Diversification Developed Europe Index ETF,TSX
DXG,Dynamic Active Global Dividend ETF,TSX
VGH,Vanguard U.S. Dividend Appreciation Index ETF CAD-hedged,TSX
DSV,Discovery Metals Corp,TSX-V
RID.U,RBC Quant EAFE Dividend Leaders ETF,TSX
XDGH,iShares Core MSCI Global Quality Dividend Index ETF CAD-Hedged,TSX
GHD,Invesco S&P Global ex. Canada High Dividend Low Vol Indx ETF,AEQUITAS NEO EXCHANGE
ZZZD,BMO Tactical Dividend ETF Fund,TSX
CDZ,BlackRock iShares S&P/TSX Canadian Dividend Aristocrats Index ETF,TSX
LUC,Lucara Diamond Corp,TSX
CUD,BlackRock iShares US Dividend Growers Index ETF CAD-Hedged,TSX
FDE,First Trust AlphaDEX Emerging Market Dividend ETF CAD-Hedged,TSX
MDVD,Mackenzie Global Sustainable Dividend Index ETF CAD,TSX
ZWH,BMO US High Dividend Covered Call ETF,TSX
FHD,First Trust AlphaDEX U.S. Consumer Discretionary Sector Index ETF,TSX
ZDY.U,BMO US Dividend ETF CAD,TSX
GDEP.B,Guardian Directed Equity Path ETF Unhedged,TSX
ZDY,BMO US Dividend ETF CAD,TSX
DGR,CI Investments Inc - CI WisdomTree U.S. Qty Divi Growth Index ETF(Hedged Units),TSX
RUDH,RBC Quant U.S. Dividend Leaders CAD Hedged ETF,TSX
ZDV,BMO Canadian Dividend ETF,TSX
REM,Purpose Emerging Markets Dividend Fund,AEQUITAS NEO EXCHANGE
DGR.B,CI Investments Inc - CI WisdomTree U.S. Qty Divi Growth Index ETF(Unhedged Units),TSX
RCD,RBC Quant Canadian Dividend Leaders ETF,TSX
MWD,Mackenzie Maximum Diversification All World Developed Index ETF,TSX
DRT,DIRTT Environmental Solutions Ltd,TSX
FDV,CI First Asset Active Canadian Dividend ETF,TSX
RBDI,RBC BlueBay Global Diversified Income CAD Hedged ETF,TSX
DLR,Horizons US Dollar Currency ETF,TSX
DME,Desert Mountain Energy Corp,TSX-V
DML,Denison Mines Corp,TSX
DN,Delta 9 Cannabis Inc,TSX
DND,Dye & Durham Ltd,TSX
DOL,Dollarama Inc,TSX
DOC,CloudMD Software & Services Inc,TSX-V
DOO,BRP Inc,TSX
DII.B,Dorel Industries Inc. (Class B),TSX
DV,Dolly Varden Silver Corp,TSX-V
CINC,CI DoubleLine Income USD Fund CAD Hedged,TSX
DCBO,Docebo Inc,TSX
CCOR.B,CI DoubleLine Core Plus Fixed Income USD Fund CAD Unhedged,TSX
ZWA,BMO Covered Call Dow Jones Industrial Average Hedged to CAD ETF,TSX
FSR,First Trust Dorsey Wright U.S. Sector Rotation Index ETF,TSX
CCOR,CI DoubleLine Core Plus Fixed Income USD Fund CAD Hedged,TSX
TD,Toronto Dominion Bank,TSX
ZDJ,BMO Dow Jones Industrial Average Hedged to CAD Index ETF,TSX
NGLD,New Placer Dome Gold Corp.,TSX-V
CDLB,CI DoubleLine Total Return Bond USD Fund ETF CAD Hedged,TSX
DLR,Horizons US Dollar Currency ETF,TSX
CDLB.B,CI DoubleLine Total Return Bond USD Fund ETF CAD Unhedged,TSX
CINC.B,CI DoubleLine Income USD Fund  CAD Unhedged,TSX
DPM,Dundee Precious Metals Inc.,TSX
DQD,CI Investments Inc - CI WisdomTree U.S. Quality Dividend Growth Variably Hedged Index ETF,TSX
DQI,CI Investments Inc - CI WisdomTree International Qty Divi Growth Variably Hedged Index ETF,TSX
DR,Medical Facilities Corp,TSX
DRA.UN,Dream Hard Asset Alternatives Trust,TSX
DRM,DREAM Unlimited Corp (Class A),TSX
DRCU,Desjardins RI Active Canadian Bond - Low CO2 ETF,TSX
DRMD,Desjardins RI Developed ex USA ex-Canada - Low CO2 Index ETF,TSX
DRFC,Desjardins RI Canada Multifactor - Low CO2 ETF,TSX
DRT,DIRTT Environmental Solutions Ltd,TSX
DRFG,Desjardins RI Global Multifactor Fossil Fuel Reserves Free ETF,TSX
DRMU,Desjardins RI USA Low CO2 Index ETF,TSX
DRFD,Desjardins RI Developed ex USA ex-Canada Multifactor - Low CO2 ETF,TSX
DRMC,Desjardins RI Canada Low CO2 Index ETF,TSX
DRFU,Desjardins RI USA Multifactor - Low CO2 ETF,TSX
DRFE,Desjardins RI Emerging Markets Multifactor Low CO2 ETF,TSX
PD,Precision Drilling Corp,TSX
MDI,Major Drilling Group International Inc.,TSX
D.UN,Dream Office Real Estate Investment Trust (Series A),TSX
AKT.A,Akita Drilling Ltd. (Class A),TSX
DIR.UN,Dream Industrial Real Estate Investment Trust,TSX
FLT,Drone Delivery Canada Corp,TSX-V
DSV,Discovery Metals Corp,TSX-V
DSG,Descartes Systems Group Inc,TSX
FLSD,Franklin Liberty Short Duration Bond ETF,TSX
PLDI,PIMCO Low Duration Monthly Income Fund,TSX
DND,Dye & Durham Ltd,TSX
DC.A,Dundee Corporation (Class A),TSX
FLB,CI First Asset Long Duration Fixed Income ETF,TSX
CSD,BlackRock iShares Short Duration High Income ETF CAD-Hedged,TSX
FSB,CI First Asset Enhanced Short Duration Bond ETF,TSX
TGOD,Green Organic Dutchman Holdings Ltd,TSX
PHR,Purpose Duration Hedged Real Estate Fund,TSX
DPM,Dundee Precious Metals Inc.,TSX
DV,Dolly Varden Silver Corp,TSX-V
DWG.U,Invesco DWA Global Momentum Unhedged Index ETF,AEQUITAS NEO EXCHANGE
DWG.F,Invesco DWA Global Momentum CAD Hedged Index ETF,AEQUITAS NEO EXCHANGE
DWG,Invesco DWA Global Momentum Unhedged Index ETF,AEQUITAS NEO EXCHANGE
DXB,Dynamic Active Tactical Bond ETF,TSX
DXV,Dynamic Active Investment Grade Floating Rate ETF,TSX
DXG,Dynamic Active Global Dividend ETF,TSX
DXM,CI First Asset Morningstar Canada Dividend Target 30 Index ETF,TSX
DXN,Dynamic Active Global Infrastructure ETF,TSX
DXC,Dynamic Active Canadian Dividend ETF,TSX
DXF,Dynamic Active Global Financial Services ETF,TSX
DXU,Dynamic Active U.S. Dividend ETF,TSX
DXO,Dynamic Active Crossover Bond ETF,TSX
DXP,Dynamic Active Preferred Shares ETF,TSX
DXW,Dynamic Active International Dividend ETF,TSX
DXZ,Dynamic Active U.S. Mid-Cap ETF,TSX
DYA,DynaCERT Inc,TSX
DXB,Dynamic Active Tactical Bond ETF,TSX
DXV,Dynamic Active Investment Grade Floating Rate ETF,TSX
DXG,Dynamic Active Global Dividend ETF,TSX
DND,Dye & Durham Ltd,TSX
DXN,Dynamic Active Global Infrastructure ETF,TSX
DXC,Dynamic Active Canadian Dividend ETF,TSX
DXF,Dynamic Active Global Financial Services ETF,TSX
DXU,Dynamic Active U.S. Dividend ETF,TSX
NDM,Northern Dynasty Minerals Ltd.,TSX
DXO,Dynamic Active Crossover Bond ETF,TSX
DXP,Dynamic Active Preferred Shares ETF,TSX
DXW,Dynamic Active International Dividend ETF,TSX
DXZ,Dynamic Active U.S. Mid-Cap ETF,TSX
EARK.U,Emerge ARK Global Disruptive Innovation ETF,AEQUITAS NEO EXCHANGE
EAAI.U,Emerge ARK AI & Big Data ETF,AEQUITAS NEO EXCHANGE
EAGB.U,Emerge ARK Genomics & Biotech ETF,AEQUITAS NEO EXCHANGE
EARK,Emerge ARK Global Disruptive Innovation ETF,AEQUITAS NEO EXCHANGE
EAUT.U,Emerge ARK Autonomous Tech & Robotics ETF,AEQUITAS NEO EXCHANGE
EAUT,Emerge ARK Autonomous Tech & Robotics ETF,AEQUITAS NEO EXCHANGE
EAAI,Emerge ARK AI & Big Data ETF,AEQUITAS NEO EXCHANGE
EARN,Evolve Active Global Fixed Income Fund Hedged,TSX
EAFT,Emerge ARK Fintech Innovation ETF,AEQUITAS NEO EXCHANGE
EAGB,Emerge ARK Genomics & Biotech ETF,AEQUITAS NEO EXCHANGE
XEF,BlackRock Canada iShares Core MSCI EAFE IMI Index ETF,TSX
RID.U,RBC Quant EAFE Dividend Leaders ETF,TSX
XEF.U,BlackRock Canada iShares Core MSCI EAFE IMI Index ETF,TSX
XFH,BlackRock Canada iShares Core MSCI EAFE IMI Index ETF CAD Hedged,TSX
XML,BlackRock Canada iShares Edge MSCI Min Vol EAFE Index ETF CAD-Hedged,TSX
XMI,BlackRock Canada iShares Edge MSCI Min Vol EAFE Index ETF,TSX
RIDH,RBC Quant EAFE Dividend Leaders CAD Hedged ETF,TSX
AEM,Agnico Eagle Mines Ltd,TSX
ZEA,BMO MSCI EAFE Index ETF,TSX
XFF,iShares Edge MSCI Multifactor EAFE Index ETF CAD-Hedged,TSX
XDSR,iShares ESG Advanced MSCI EAFE Index ETF,TSX
RIEH,RBC Quant EAFE Equity Leaders CAD Hedged ETF,TSX
RID,RBC Quant EAFE Dividend Leaders ETF,TSX
ZVI,BMO MSCI EAFE Value Index ETF,TSX
XFI,iShares Edge MSCI Multifactor EAFE Index ETF,TSX
ESGE,BMO MSCI EAFE ESG Leaders Index ETF,TSX
XSEA,iShares ESG Aware MSCI EAFE Index ETF,TSX
ZDM,BMO MSCI EAFE Hedged to CAD Index ETF,TSX
XIN,BlackRock Canada iShares MSCI EAFE Index ETF CAD-Hedged,TSX
ECO,EcoSynthetix Inc,TSX
ECN,ECN Capital Corp,TSX
EGLD,Eclipse Gold Mining Corporation,TSX-V
EFH,Echelon Financial Holdings Inc,TSX
LONG,CI Global Longevity Economy Fund,TSX
EOG,Eco (Atlantic) Oil & Gas Ltd,TSX-V
EDGF,Brompton Funds Ltd - Brompton European Dividend Growth ETF,TSX
EDV,Endeavour Mining Corp,TSX
EDR,Endeavour Silver Corp.,TSX
EDGE,Evolve Innovation Index Fund Hedged,TSX
EDT,Spectral Medical Inc,TSX
XFA,iShares Edge MSCI Multifactor USA Index ETF CAD-Hedged,TSX
XMU.U,BlackRock Canada iShares Edge MSCI Min Vol USA Index ETF,TSX
XFC,iShares Edge MSCI Multifactor Canada Index ETF,TSX
XMV,BlackRock Canada iShares Edge MSCI Min Vol Canada Index ETF,TSX
XQLT,iShares Edge MSCI USA Quality Factor Index ETF,TSX
XML,BlackRock Canada iShares Edge MSCI Min Vol EAFE Index ETF CAD-Hedged,TSX
XMS,BlackRock iShares Edge MSCI Min Vol USA Index ETF CAD-Hedged,TSX
XMI,BlackRock Canada iShares Edge MSCI Min Vol EAFE Index ETF,TSX
XMTM,iShares Edge MSCI USA Momentum Factor Index ETF,TSX
XMU,BlackRock Canada iShares Edge MSCI Min Vol USA Index ETF,TSX
XVLU,iShares Edge MSCI USA Value Factor Index ETF,TSX
AOE.H,Access International Education LTD.,TSX-V
XFF,iShares Edge MSCI Multifactor EAFE Index ETF CAD-Hedged,TSX
XFS.U,iShares Edge MSCI Multifactor USA Index ETF,TSX
XMY,BlackRock Canada iShares Edge MSCI Min Vol Global Index ETF CAD-Hedge,TSX
XMM,BlackRock Canada iShares Edge MSCI Min Vol Emerging Markets Index ETF,TSX
XFS,iShares Edge MSCI Multifactor USA Index ETF,TSX
XFI,iShares Edge MSCI Multifactor EAFE Index ETF,TSX
EFX,Enerflex Ltd,TSX
EFH,Echelon Financial Holdings Inc,TSX
EFR,Energy Fuels Inc,TSX
EFN,Element Fleet Management Corp,TSX
EGLD,Eclipse Gold Mining Corporation,TSX-V
EGLX,Enthusiast Gaming Holdings Inc.,TSX
EGIF,Exemplar Growth and Income Fund Series ETF units,TSX
EHE.B,CI WisdomTree Europe Hedged Equity Index ETF Unhedged,TSX
EHE,CI Investments Inc - CI WisdomTree Europe Hedged Equity Index ETF,TSX
EIT.UN,Canoe EIT Income Fund,TSX
EIF,Exchange Income Corp,TSX
ELO,Eloro Resources Ltd,TSX-V
ELEF,Silver Elephant Mining Corp,TSX
ELD,Eldorado Gold Corp.,TSX
ELY,Ely Gold Royalties Inc,TSX-V
ELV,Invesco S&P Emerging Markets Low Volatility Index ETF,TSX
CRE,Critical Elements Lithium Corporation,TSX-V
BABY,Else Nutrition Holdings Inc,TSX-V
EFN,Element Fleet Management Corp,TSX
EMA,Emera Inc.,TSX
EMP.A,"Empire Co., Ltd. (Class A)",TSX
EMH,Emerald Health Therapeutics Inc,TSX-V
EMV.B,CI Investments Inc - CI WisdomTree Emerging Mkts Divi Index ETF(Unhedged Units),TSX
HEMB,Horizons Active Emerging Markets Bond ETF Class A,TSX
EARK.U,Emerge ARK Global Disruptive Innovation ETF,AEQUITAS NEO EXCHANGE
IEMB,IA Clarington Emerging Markets Bond Fund,TSX
XSEM,iShares ESG Aware MSCI Emerging Markets Index ETF,TSX
FDE,First Trust AlphaDEX Emerging Market Dividend ETF CAD-Hedged,TSX
ELV,Invesco S&P Emerging Markets Low Volatility Index ETF,TSX
DFE,Desjardins Emerging Markets Multifactor-Controlled Volatility ETF,TSX
QEBL,Mackenzie Emerging Markets Local Currency Bond Index ETF Ser E,TSX
ZLE,BMO Low Volatility Emerging Markets Equity ETF,TSX
MEME.B,Manulife Multifactor Emerging Markets Index ETFUnhedged,TSX
REM,Purpose Emerging Markets Dividend Fund,AEQUITAS NEO EXCHANGE
ZEF,BMO Emerging Markets Bond Hedged to CAD Index ETF,TSX
RXE.U,RBC Quant Emerging Markets Eqty Leaders ETF CAD,TSX
CWO,BlackRock iShares Emerging Markets Fundamental Index ETF,AEQUITAS NEO EXCHANGE
EAAI.U,Emerge ARK AI & Big Data ETF,AEQUITAS NEO EXCHANGE
EAGB.U,Emerge ARK Genomics & Biotech ETF,AEQUITAS NEO EXCHANGE
ZEM,BMO MSCI Emerging Markets Index ETF,TSX
XEB,iShares J.P. Morgan USD Emerging Markets Bond Index ETF CAD-Hedged,TSX
EARK,Emerge ARK Global Disruptive Innovation ETF,AEQUITAS NEO EXCHANGE
QEBH,Mackenzie Emerging Markets Bond Index ETF CAD-Hedged,TSX
EAUT.U,Emerge ARK Autonomous Tech & Robotics ETF,AEQUITAS NEO EXCHANGE
FLEM,Franklin LibertyQT Emerging Markets Index ETF,TSX
MEE,Mackenzie Maximum Diversification Emerging Markets Index ETF,TSX
XEC,BlackRock Canada iShares Core MSCI Emerging Markets IMI Index ETF,TSX
VEE,Vanguard FTSE Emerging Markets All Cap Index ETF,TSX
HXEM,Horizons Emerging Markets Equity Index ETF,TSX
QEM,AGFiQ Emerging Markets Equity ETF,TSX
EAUT,Emerge ARK Autonomous Tech & Robotics ETF,AEQUITAS NEO EXCHANGE
XEC.U,BlackRock Canada iShares Core MSCI Emerging Markets IMI Index ETF,TSX
XMM,BlackRock Canada iShares Edge MSCI Min Vol Emerging Markets Index ETF,TSX
EAAI,Emerge ARK AI & Big Data ETF,AEQUITAS NEO EXCHANGE
FDE.A,First Trust AlphaDEX Emerging Market Div ETFCAD-Hedged-Advisor Class,TSX
XEM,BlackRock Canada iShares MSCI Emerging Markets Index ETF,TSX
RXE,RBC Quant Emerging Markets Eqty Leaders ETF CAD,TSX
RXD,RBC Quant Emerging Markets Dividend Leaders ETF CAD,TSX
RXD.U,RBC Quant Emerging Markets Dividend Leaders ETF CAD,TSX
EAFT,Emerge ARK Fintech Innovation ETF,AEQUITAS NEO EXCHANGE
DRFE,Desjardins RI Emerging Markets Multifactor Low CO2 ETF,TSX
EAGB,Emerge ARK Genomics & Biotech ETF,AEQUITAS NEO EXCHANGE
ENB,Enbridge Inc,TSX
ENGH,Enghouse Systems Ltd,TSX
NXF.B,CI First Asset Energy Giants Covered Call ETF Unhedged,TSX
ETG,Entree Resources Ltd,TSX
HWO,High Arctic Energy Services Inc,TSX
CAGS,CI Investments Inc - CI Yield Enhanced Canada Short-Term Aggregate Bond Index ETF,TSX
INE,Innergex Renewable Energy Inc,TSX
GEI,Gibson Energy Inc,TSX
GFL,GFL Environmental Inc.,TSX
CR,Crew Energy Inc.,TSX
CJR.B,"Corus Entertainment, Inc. (Class B)",TSX
FGO.U,CI First Asset Enhanced Government Bond ETF,TSX
CAGG,CI Investments Inc - CI Yield Enhanced Canada Aggregate Bond Index ETF,TSX
ERF,Enerplus Corporation,TSX
GASX,NGX Energy International Corp.,TSX-V
CMEY.U,CI Marret Alternative Enhanced Yield Fund hedged units,TSX
CJ,Cardinal Energy Ltd,TSX
GXE,Gear Energy Ltd,TSX
XEG,BlackRock Canada iShares S&P/TSX Capped Energy Index ETF,TSX
CALL.U,Evolve US Banks Enhanced Yield Fund Unhedged,TSX
PAYF,Purpose Enhanced Premium Yield Fund ETF,TSX
LIFE.U,Evolve Global Healthcare Enhanced Yield Fund Unhedged,TSX
NXF,CI First Asset Energy Giants Covered Call ETF,TSX
MEG,MEG Energy Corp,TSX
SGY,Surge Energy Inc,TSX
SFD,NXT Energy Solutions Inc,TSX
VII,Seven Generations Energy Ltd. (Class A),TSX
STEP,STEP Energy Services Ltd,TSX
EFX,Enerflex Ltd,TSX
BTE,Baytex Energy Corp,TSX
BES,Braille Energy Systems Inc,TSX-V
FHE,First Trust AlphaDEX U.S. Energy Sector Index ETF,TSX
CEU,CES Energy Solutions Corp,TSX
BASE.B,Evolve Global Materials & Mining Enh Yield Index ETF  Unhedged,TSX
DRT,DIRTT Environmental Solutions Ltd,TSX
EOG,Eco (Atlantic) Oil & Gas Ltd,TSX-V
ZUT,BMO EQ Wght UT Trust Units,TSX
EQX,Equinox Gold Corp,TSX
EQE,Invesco S&P Europe 350 Equal Weight Index ETF CAD-unhedged,AEQUITAS NEO EXCHANGE
EQL,Invesco S&P 500 Equal Weight Index ETF,TSX
EQL.F,Invesco S&P 500 Equal Weight Index ETF CAD Hedged,TSX
EQL.U,Invesco S&P 500 Equal Weight Index ETF,TSX
EQE.F,Invesco S&P Europe 350 Equal Weight Index ETF CAD-hedged,AEQUITAS NEO EXCHANGE
QUU,Mackenzie US Large Cap Equity Index ETF Series E,TSX
HCRE,Horizons Equal Weight Canada REIT Index ETF,TSX
NSGE,NBI Sustainable Global Equity ETF,TSX
ZHU,BMO Equal Weight US Health Care Index ETF,TSX
RCE,RBC Quant Canadian Equity Leaders ETF,TSX
JAPN.B,CI Investments Inc - CI WisdomTree Japan Equity Index ETF(Unhedged Units),TSX
PHE.B,Purpose Tactical Hedged Equity Fund NON-CURRENCY HEDGED SHARES,TSX
AD.UN,Alaris Equity Partners Income Trust,TSX
CSY,CI First Asset Core Canadian Equity Income Class ETF,TSX
ZNQ,BMO Nasdaq 100 Equity Index ETF,TSX
FLRM,Franklin Liberty Risk Managed Canadian Equity ETF,TSX
ZFC,BMO SIA Focused Canadian Equity Fund,TSX
TQSM,TD Q U.S. Small-Mid-Cap Equity ETF,TSX
ZMT,BMO Equal Weight Global Base Metals Hedged to CAD Index ETF,TSX
AGSG,AGF Global Sustainable Growth Equity ETF,AEQUITAS NEO EXCHANGE
CINT,CIBC International Equity ETF,TSX
ZRE,BMO Equal Weight REITs Index ETF,TSX
ZLU.U,BMO Low Volatility US Equity ETF CAD,TSX
TPU,TD U.S. Equity Index ETF,TSX
GDEP.B,Guardian Directed Equity Path ETF Unhedged,TSX
ZUH,BMO Equal Weight US Health Care Hdgd to CAD Index ETF,TSX
ZBK,BMO Equal Weight US Banks Index ETF,TSX
ZLE,BMO Low Volatility Emerging Markets Equity ETF,TSX
QCE,Mackenzie Canadian Large Cap Equity Index ETF Series E,TSX
ZUB,BMO Equal Weight US Banks Hedged to CAD Index ETF,TSX
EHE.B,CI WisdomTree Europe Hedged Equity Index ETF Unhedged,TSX
RXE.U,RBC Quant Emerging Markets Eqty Leaders ETF CAD,TSX
MIVG,Mackenzie Ivy Global Equity ETF Series E,TSX
